{
  "schema": "deskbot.expression_mapping_layers/v1",
  "default_layer": "official",
  "binding_version": "deskbot.expression_bindings/v1",
  "asset_version": "deskbot.expression_assets/e1-4c-shy-legacy-v1",
  "release_id": "e1-4c-shy-replacement-offline",
  "replacement_semantic": "embarrassed",
  "profile_intents": [
    "bashful"
  ],
  "profile_expression_map_before": {
    "greeting": {
      "semantic_id": "happy",
      "resource_id": "Happy.eaf",
      "sha256": "2ed3a64ecdb7a78e2c9959bfc3758c2742d5447d4a2bcdc6d2bf072763deba5c",
      "bytes": 81645,
      "fps": 20,
      "loop": true,
      "action_id": "shark_head"
    },
    "thinking": {
      "semantic_id": "confused",
      "resource_id": "confused.eaf",
      "sha256": "dafcdbe72939d7ef1061466caa30eb83517e953f284b53d9f6d708ac4319a05d",
      "bytes": 211666,
      "fps": 20,
      "loop": true,
      "action_id": "look_around"
    },
    "bashful": {
      "semantic_id": "embarrassed",
      "resource_id": "Happy.eaf",
      "sha256": "2ed3a64ecdb7a78e2c9959bfc3758c2742d5447d4a2bcdc6d2bf072763deba5c",
      "bytes": 81645,
      "fps": 20,
      "loop": true,
      "action_id": "cat_nuzzle"
    },
    "sleep": {
      "semantic_id": "sleepy",
      "resource_id": "sleep.eaf",
      "sha256": "efa178f2d486c1143bff99f3304847fc73909e9ba60bcc52182fd818fe9ce680",
      "bytes": 184689,
      "fps": 20,
      "loop": true,
      "action_id": "shark_head_decay"
    },
    "unknown_shell": {
      "semantic_id": "question",
      "resource_id": "question.eaf",
      "sha256": "57484fa147c53ce0ac9e70d42416c8650b1649d70e360bf65ec77121903ce5bc",
      "bytes": 363158,
      "fps": 20,
      "loop": false,
      "action_id": null
    }
  },
  "profile_expression_map_after": {
    "greeting": {
      "semantic_id": "happy",
      "resource_id": "Happy.eaf",
      "sha256": "2ed3a64ecdb7a78e2c9959bfc3758c2742d5447d4a2bcdc6d2bf072763deba5c",
      "bytes": 81645,
      "fps": 20,
      "loop": true,
      "action_id": "shark_head"
    },
    "thinking": {
      "semantic_id": "confused",
      "resource_id": "confused.eaf",
      "sha256": "dafcdbe72939d7ef1061466caa30eb83517e953f284b53d9f6d708ac4319a05d",
      "bytes": 211666,
      "fps": 20,
      "loop": true,
      "action_id": "look_around"
    },
    "bashful": {
      "semantic_id": "embarrassed",
      "resource_id": "shy_legacy.eaf",
      "sha256": "4dd57777598dc1517fcf770fd859894567fbaa434373ef604e4d080e9331a5b1",
      "bytes": 661508,
      "fps": 25,
      "loop": false,
      "action_id": "cat_nuzzle"
    },
    "sleep": {
      "semantic_id": "sleepy",
      "resource_id": "sleep.eaf",
      "sha256": "efa178f2d486c1143bff99f3304847fc73909e9ba60bcc52182fd818fe9ce680",
      "bytes": 184689,
      "fps": 20,
      "loop": true,
      "action_id": "shark_head_decay"
    },
    "unknown_shell": {
      "semantic_id": "question",
      "resource_id": "question.eaf",
      "sha256": "57484fa147c53ce0ac9e70d42416c8650b1649d70e360bf65ec77121903ce5bc",
      "bytes": 363158,
      "fps": 20,
      "loop": false,
      "action_id": null
    }
  },
  "comparison": {
    "changed_semantics": [
      "embarrassed"
    ],
    "unchanged_semantic_count": 28,
    "official_emotion_action_map_sha256": "a4c13bf97ff3cba1f7fd3b4ee80466b35d665feda97b4f7af668269c775ab327",
    "action_map_unchanged": true,
    "fallback_exact": true,
    "candidate_atlas_sha256": "e4b46a86241c1056ebdac9208063897808c14ca9a6048eacb9f85a3107cf3d00"
  },
  "layers": {
    "official": {
      "label": "官方",
      "kind": "official_baseline",
      "read_only": true,
      "description": "固定官方源码映射；只读基线。",
      "semantic_map": {
        "happy": {
          "resource_id": "Happy.eaf",
          "sha256": "2ed3a64ecdb7a78e2c9959bfc3758c2742d5447d4a2bcdc6d2bf072763deba5c",
          "bytes": 81645,
          "fps": 20,
          "loop": true,
          "action_id": "shark_head",
          "asset_key": "eaf-2ed3a64ecdb7a78e",
          "expression_id": "happy",
          "layout_override": null,
          "segments": null
        },
        "laughing": {
          "resource_id": "Happy.eaf",
          "sha256": "2ed3a64ecdb7a78e2c9959bfc3758c2742d5447d4a2bcdc6d2bf072763deba5c",
          "bytes": 81645,
          "fps": 20,
          "loop": true,
          "action_id": "shark_head",
          "asset_key": "eaf-2ed3a64ecdb7a78e",
          "expression_id": "laughing",
          "layout_override": null,
          "segments": null
        },
        "funny": {
          "resource_id": "Happy.eaf",
          "sha256": "2ed3a64ecdb7a78e2c9959bfc3758c2742d5447d4a2bcdc6d2bf072763deba5c",
          "bytes": 81645,
          "fps": 20,
          "loop": true,
          "action_id": "shark_head",
          "asset_key": "eaf-2ed3a64ecdb7a78e",
          "expression_id": "funny",
          "layout_override": null,
          "segments": null
        },
        "loving": {
          "resource_id": "Happy.eaf",
          "sha256": "2ed3a64ecdb7a78e2c9959bfc3758c2742d5447d4a2bcdc6d2bf072763deba5c",
          "bytes": 81645,
          "fps": 20,
          "loop": true,
          "action_id": "shark_head",
          "asset_key": "eaf-2ed3a64ecdb7a78e",
          "expression_id": "loving",
          "layout_override": null,
          "segments": null
        },
        "embarrassed": {
          "resource_id": "Happy.eaf",
          "sha256": "2ed3a64ecdb7a78e2c9959bfc3758c2742d5447d4a2bcdc6d2bf072763deba5c",
          "bytes": 81645,
          "fps": 20,
          "loop": true,
          "action_id": "cat_nuzzle",
          "asset_key": "eaf-2ed3a64ecdb7a78e",
          "expression_id": "embarrassed",
          "layout_override": null,
          "segments": null
        },
        "confident": {
          "resource_id": "Happy.eaf",
          "sha256": "2ed3a64ecdb7a78e2c9959bfc3758c2742d5447d4a2bcdc6d2bf072763deba5c",
          "bytes": 81645,
          "fps": 20,
          "loop": true,
          "action_id": "shark_head",
          "asset_key": "eaf-2ed3a64ecdb7a78e",
          "expression_id": "confident",
          "layout_override": null,
          "segments": null
        },
        "delicious": {
          "resource_id": "Happy.eaf",
          "sha256": "2ed3a64ecdb7a78e2c9959bfc3758c2742d5447d4a2bcdc6d2bf072763deba5c",
          "bytes": 81645,
          "fps": 20,
          "loop": true,
          "action_id": "shark_head",
          "asset_key": "eaf-2ed3a64ecdb7a78e",
          "expression_id": "delicious",
          "layout_override": null,
          "segments": null
        },
        "sad": {
          "resource_id": "Sad.eaf",
          "sha256": "b9e0e2fb4e73e96edc331c3736f9d952de2507a711da34a5587c4426dcbca7e8",
          "bytes": 177137,
          "fps": 20,
          "loop": true,
          "action_id": "shark_head_decay",
          "asset_key": "eaf-b9e0e2fb4e73e96e",
          "expression_id": "sad",
          "layout_override": null,
          "segments": null
        },
        "crying": {
          "resource_id": "cry.eaf",
          "sha256": "d09e4eb5ca10ff7040af3ff0b6ce3ad06db0a5902935bf4b02d50b09dcf9e2c2",
          "bytes": 89412,
          "fps": 20,
          "loop": true,
          "action_id": "shark_head_decay",
          "asset_key": "eaf-d09e4eb5ca10ff70",
          "expression_id": "crying",
          "layout_override": null,
          "segments": null
        },
        "sleepy": {
          "resource_id": "sleep.eaf",
          "sha256": "efa178f2d486c1143bff99f3304847fc73909e9ba60bcc52182fd818fe9ce680",
          "bytes": 184689,
          "fps": 20,
          "loop": true,
          "action_id": "shark_head_decay",
          "asset_key": "eaf-efa178f2d486c114",
          "expression_id": "sleepy",
          "layout_override": null,
          "segments": null
        },
        "silly": {
          "resource_id": "Happy.eaf",
          "sha256": "2ed3a64ecdb7a78e2c9959bfc3758c2742d5447d4a2bcdc6d2bf072763deba5c",
          "bytes": 81645,
          "fps": 20,
          "loop": true,
          "action_id": "look_around",
          "asset_key": "eaf-2ed3a64ecdb7a78e",
          "expression_id": "silly",
          "layout_override": null,
          "segments": null
        },
        "angry": {
          "resource_id": "angry.eaf",
          "sha256": "63f6fa85175ad53f9c0c1fde0a5c19210257ec69f4cb45660d3db1fabdf9743a",
          "bytes": 98391,
          "fps": 20,
          "loop": true,
          "action_id": "beat_swing",
          "asset_key": "eaf-63f6fa85175ad53f",
          "expression_id": "angry",
          "layout_override": null,
          "segments": null
        },
        "surprised": {
          "resource_id": "Happy.eaf",
          "sha256": "2ed3a64ecdb7a78e2c9959bfc3758c2742d5447d4a2bcdc6d2bf072763deba5c",
          "bytes": 81645,
          "fps": 20,
          "loop": true,
          "action_id": "look_around",
          "asset_key": "eaf-2ed3a64ecdb7a78e",
          "expression_id": "surprised",
          "layout_override": null,
          "segments": null
        },
        "shocked": {
          "resource_id": "shocked.eaf",
          "sha256": "bf97df5acdb7b64a34bb1f32ee2d5fd98a1117c6f06daad4a30e99ec44b47cf8",
          "bytes": 64963,
          "fps": 20,
          "loop": true,
          "action_id": "look_around",
          "asset_key": "eaf-bf97df5acdb7b64a",
          "expression_id": "shocked",
          "layout_override": null,
          "segments": null
        },
        "thinking": {
          "resource_id": "confused.eaf",
          "sha256": "dafcdbe72939d7ef1061466caa30eb83517e953f284b53d9f6d708ac4319a05d",
          "bytes": 211666,
          "fps": 20,
          "loop": true,
          "action_id": "shark_head",
          "asset_key": "eaf-dafcdbe72939d7ef",
          "expression_id": "thinking",
          "layout_override": null,
          "segments": null
        },
        "winking": {
          "resource_id": "neutral.eaf",